{
  "schema_version": 1,
  "objective": {
    "visible_selector": "[data-objective]",
    "expected_text": "Break 3 dreadnoughts. Recruit their shards."
  },
  "progress": {
    "selector": "[data-product-progress]",
    "state_path": "state.completed",
    "format": "BREACHED {value} / 3",
    "milestones": [
      1,
      2,
      3
    ]
  },
  "score": {
    "selector": "[data-game-score]",
    "label_selector": "[data-score-label]",
    "expected_label": "CURRENT SCORE",
    "reversible_probes": [
      [
        "left",
        "left"
      ],
      [
        "right",
        "right"
      ]
    ],
    "no_progress_probes": [
      [
        "fire"
      ],
      [
        "up"
      ],
      [
        "down"
      ]
    ]
  },
  "best": {
    "selector": "[data-best]",
    "label_selector": "[data-best-label]",
    "expected_label": "DEVICE BEST",
    "source": "GameKit.best"
  },
  "completion": {
    "state_path": "state.outcome",
    "success_value": "success",
    "failure_value": "failure",
    "result_selector": "[data-result]",
    "success_text": "ARMADA ASCENDANT",
    "failure_text": "STORM OVERTOOK YOU",
    "max_terminal_latency_ms": 100,
    "failure_wait_ms": 46000,
    "failure_actions": []
  },
  "replay": {
    "selector": "[data-game-restart]",
    "must_be_in_initial_mobile_viewport": true
  },
  "difficulty": {
    "deterministic_seeds": [
      1,
      7,
      23,
      89,
      2026,
      4294967295
    ],
    "oracle_id": "shard-armada-v1",
    "oracle_sha256": "dd7d8974311b5c31cbf8d0fc51761525817b651caa8c6b80160c3e85ec055048",
    "projection": [
      "state.stage",
      "state.captured",
      "state.focus",
      "state.polarity",
      "state.outcome"
    ],
    "stage_path": "quality.stage",
    "complexity_path": "quality.complexity",
    "meaningful_actions_path": "quality.meaningful_actions",
    "reversible_state_path": "quality.reversible_state_key",
    "required_monotonicity": "later_strictly_greater",
    "max_actions": 64
  },
  "mobile": {
    "critical_selectors": [
      "[data-objective]",
      "[data-product-progress]",
      "[data-score-label]",
      "[data-game-score]",
      "[data-best-label]",
      "[data-best]",
      "[data-result]"
    ],
    "control_selectors": [
      "[data-game-start]",
      "[data-game-pause]",
      "[data-game-resume]",
      "[data-game-restart]",
      "[data-mute]"
    ],
    "canvas_selector": "[data-game-canvas]",
    "canvas_control_regions": [
      {
        "x": 0.14,
        "y": 0.265,
        "width": 0.22,
        "height": 0.15
      },
      {
        "x": 0.64,
        "y": 0.265,
        "width": 0.22,
        "height": 0.15
      },
      {
        "x": 0.39,
        "y": 0.085,
        "width": 0.22,
        "height": 0.15
      },
      {
        "x": 0.39,
        "y": 0.455,
        "width": 0.22,
        "height": 0.15
      },
      {
        "x": 0.39,
        "y": 0.8550000000000001,
        "width": 0.22,
        "height": 0.15
      }
    ],
    "min_font_px": 14,
    "min_hit_target_px": 44
  },
  "reduced_motion": {
    "presentation_probe_path": "presentation.reduced_motion",
    "dynamic_change_required": true
  },
  "feedback": {
    "action": "left",
    "state_change_path": "quality.reversible_state_key",
    "visual_probe": "[data-game-canvas]",
    "active_probe_path": "presentation.feedback_active",
    "static_probe_path": "presentation.static_feedback",
    "settle_ms": 400
  },
  "actions": {
    "left": {
      "key": "ArrowLeft",
      "touch": {
        "x": 0.25,
        "y": 0.34
      },
      "hold_ms": 35,
      "settle_ms": 35
    },
    "right": {
      "key": "ArrowRight",
      "touch": {
        "x": 0.75,
        "y": 0.34
      },
      "hold_ms": 35,
      "settle_ms": 35
    },
    "up": {
      "key": "ArrowUp",
      "touch": {
        "x": 0.5,
        "y": 0.16
      },
      "hold_ms": 35,
      "settle_ms": 35
    },
    "down": {
      "key": "ArrowDown",
      "touch": {
        "x": 0.5,
        "y": 0.53
      },
      "hold_ms": 35,
      "settle_ms": 35
    },
    "fire": {
      "key": "Space",
      "touch": {
        "x": 0.5,
        "y": 0.93
      },
      "hold_ms": 35,
      "settle_ms": 35
    }
  }
}
